http://elijah.biz;1;2020-05-11 19:11:08;58;;Lorem ipsum dolor sit amet
https://shanon.org;1;2020-05-11 19:11:08;35;NewYork;Pellentesque viverra ligula vitae mi rhoncus finibus.
http://vicky.biz;1;2020-05-11 19:11:08;30;Moscow;Sed sollicitudin dolor eget dignissim vestibulum.
http://oleta.net;1;2020-05-11 19:11:08;32;London;Quisque facilisis tellus eu feugiat pharetra.
https://jennings.biz;1;2020-05-11 19:11:08;34;Sao Paulo;Quisque vitae erat in mi volutpat pellentesque.
https://quinn.biz;2;2020-05-11 19:11:08;40;Paris;In iaculis lacus ut nisl gravida varius.
https://selina.name;2;2020-05-11 19:11:08;43;Los Angeles
http://malvina.org;2;2020-05-11 19:11:08;38;St. Petersburg
https://branson.biz;2;2020-05-11 19:11:08;37;Jakarta;Aenean sit amet lectus lacinia
https://elenor.name;3;2020-05-11 19:11:08;57;Istanbul;Cras vitae enim et augue gravida congue.
https://marcelino.com;3;2020-05-11 19:11:08;42;Barcelona;Duis ornare lacus at urna porttitor lobortis.
http://felicity.name;3;2020-05-11 19:11:08;53;Disneyland;Sed luctus nibh at tellus vehicula
https://fred.com;3;2020-05-11 19:11:08;29;Times Square
https://gerhard.biz;4;2020-05-11 19:11:08;37;Central Park
https://sherwood.net;4;2020-05-11 19:11:08;22;Eiffel Tower;Proin placerat orci ac orci gravida blandit.
https://maudie.org;4;2020-05-11 19:11:08;25;Tokyo Disneyland;Integer et sem eu ipsum condimentum lacinia.
http://annamae.name;6;2020-05-11 19:11:08;31;Disney's Magic Kingdom
https://mac.org;6;2020-05-11 19:11:08;55;Louvre Museum
http://miracle.info;6;2020-05-11 19:11:08;31;Brooklyn Bridge;Duis lacinia nunc quis varius ullamcorper.
http://emmet.com;6;2020-05-11 19:11:08;54;Disney California Adventure Park;Nullam ornare libero in lectus hendrerit suscipit.
https://lisa.com;6;2020-05-11 19:11:08;57;Louvre Museum;Proin eget lectus tristique
https://brooklyn.name;8;2020-05-11 19:11:08;25;The Metropolitan Museum of Art;Donec eu orci facilisis
http://madison.net;8;2020-05-11 19:11:08;47;The Museum of Modern Art
http://annie.name;8;2020-05-11 19:11:08;25;Los Angeles County Museum of Art
http://darron.info;8;2020-05-11 19:11:08;30;British Museum;Sed at augue sit amet ligula commodo facilisis.
http://kenny.com;10;2020-05-11 19:11:08;44;American Museum of Natural History;Duis egestas nibh sed pretium dapibus.
http://remington.name;10;2020-05-11 19:11:08;29;Whitney Museum of American Art;Nulla a nulla a lectus finibus fermentum ac at massa.
http://kurtis.info;10;2020-05-11 19:11:08;57;Victoria and Albert Museum;Vivamus at nisi volutpat
https://alisha.com;11;2020-05-11 19:11:08;53;Natural History Museum
https://henderson.com;11;2020-05-11 19:11:08;59;Museum of Ice Cream
http://bonnie.info;11;2020-05-11 19:11:08;37;;In id sapien ut leo cursus porttitor.
http://kennith.net;11;2020-05-11 19:11:08;34;The Metropolitan Museum of Art;Morbi hendrerit nunc sed mi dictum dictum.
http://camille.name;11;2020-05-11 19:11:08;27;The Museum of Modern Art;Proin consequat nisl vel purus molestie
http://alena.net;12;2020-05-11 19:11:08;40;Los Angeles County Museum of Art
http://ralph.name;12;2020-05-11 19:11:08;51;American Museum of Natural History
https://tyshawn.com;12;2020-05-11 19:11:08;28;;Curabitur vulputate velit eu porta placerat.
https://adella.net;12;2020-05-11 19:11:08;41;;Pellentesque consequat ligula quis dignissim semper.
https://cielo.info;13;2020-05-11 19:11:08;54;;
https://easter.net;13;2020-05-11 19:11:08;51;;
http://golden.org;13;2020-05-11 19:11:08;51;;Vivamus ac dui id ipsum consectetur blandit porttitor eget sapien.
http://kendall.biz;13;2020-05-11 19:11:08;33;;Phasellus interdum nunc at magna fermentum
https://glenda.info;13;2020-05-11 19:11:08;40;;Suspendisse ac orci sed leo laoreet placerat vel eget purus.
http://dominic.biz;15;2020-05-11 19:11:08;18;;Donec in purus non justo sagittis tempus vitae vitae ligula.
http://tressie.info;15;2020-05-11 19:11:08;36;;
http://estevan.org;15;2020-05-11 19:11:08;58;;
http://zena.com;15;2020-05-11 19:11:08;22;;Fusce imperdiet purus quis velit fringilla facilisis.
https://abagail.com;16;2020-05-11 19:11:08;44;;Maecenas vitae purus tincidunt tortor ornare condimentum.
https://hershel.com;16;2020-05-11 19:11:08;38;;Aliquam vitae nisi ac est pretium malesuada.
http://collin.com;16;2020-05-11 19:11:08;58;;
https://clair.com;16;2020-05-11 19:11:08;19;;
https://deondre.com;17;2020-05-11 19:11:08;19;;Maecenas ac ligula eu ex tempus maximus.
http://tristin.name;17;2020-05-11 19:11:08;45;;Sed condimentum libero id fermentum pulvinar.
http://kirk.org;17;2020-05-11 19:11:08;22;;Sed egestas ex nec lorem posuere gravida.
https://modesta.info;18;2020-05-11 19:11:08;27;;Proin et erat quis lorem convallis pharetra consequat vitae nulla.
http://rylan.biz;19;2020-05-11 19:11:08;52;;Morbi tincidunt enim quis magna posuere scelerisque.
https://noemie.com;19;2020-05-11 19:11:08;35;;Praesent efficitur mi fermentum sem vestibulum sollicitudin.
https://dejon.name;20;2020-05-11 19:11:08;33;;
https://rigoberto.net;22;2020-05-11 19:11:08;37;;
http://megane.biz;23;2020-05-11 19:11:08;53;;Praesent et diam eu libero vehicula tincidunt.
http://emmalee.org;23;2020-05-11 19:11:08;41;;Proin aliquam ligula nec nibh dapibus convallis.
http://nathan.net;23;2020-05-11 19:11:08;28;;Morbi porttitor tellus rutrum augue aliquam
http://lionel.net;23;2020-05-11 19:11:08;23;;Pellentesque fringilla nisl vestibulum scelerisque gravida.
http://danyka.net;23;2020-05-11 19:11:08;52;;
https://woodrow.com;23;2020-05-11 19:11:08;60;NewYork;
http://harvey.info;23;2020-05-11 19:11:08;42;Moscow;In finibus neque quis dui pharetra
http://aiden.org;23;2020-05-11 19:11:08;23;London;Vestibulum quis libero et diam dapibus euismod et at ipsum.
https://tito.name;23;2020-05-11 19:11:08;40;Sao Paulo;Nunc feugiat mi quis leo efficitur
https://julian.net;23;2020-05-11 19:11:08;56;Paris;Nulla ultricies nulla a velit mollis
https://mafalda.org;23;2020-05-11 19:11:08;59;Los Angeles;Praesent sed elit ornare
http://verner.org;23;2020-05-11 19:11:08;58;St. Petersburg;
https://elmore.org;26;2020-05-11 19:11:08;44;Jakarta;
http://kasandra.com;26;2020-05-11 19:11:08;26;Istanbul;Nam viverra turpis in euismod tincidunt.
https://jarret.info;26;2020-05-11 19:11:08;40;Barcelona;Praesent in lacus sit amet nisl vestibulum ultrices sit amet a velit.
http://einar.net;26;2020-05-11 19:11:08;18;Disneyland;Donec ullamcorper mi at dignissim iaculis.
http://terry.info;26;2020-05-11 19:11:08;40;Times Square;
https://holden.com;27;2020-05-11 19:11:08;27;Central Park;
https://jacinto.org;28;2020-05-11 19:11:08;46;Eiffel Tower;Maecenas venenatis ligula sed lectus vehicula posuere at eget turpis.
https://geoffrey.info;28;2020-05-11 19:11:08;42;Tokyo Disneyland;
http://paxton.com;28;2020-05-11 19:11:08;35;Disney's Magic Kingdom;
https://trinity.biz;28;2020-05-11 19:11:08;42;Louvre Museum;Integer vehicula quam at elit sagittis
http://fabiola.org;29;2020-05-11 19:11:08;39;Brooklyn Bridge;Pellentesque ullamcorper orci in leo placerat
https://bryce.org;29;2020-05-11 19:11:08;26;Disney California Adventure Park;Suspendisse varius ex id ex gravida
http://emery.net;29;2020-05-11 19:11:08;29;Louvre Museum;
https://marian.biz;29;2020-05-11 19:11:08;24;The Metropolitan Museum of Art;
https://kennedi.org;29;2020-05-11 19:11:08;19;The Museum of Modern Art;Donec placerat velit tempus
https://fanny.net;29;2020-05-11 19:11:08;32;Los Angeles County Museum of Art;Etiam ut orci ut lacus pellentesque egestas sed posuere dui.
http://lottie.net;29;2020-05-11 19:11:08;26;British Museum;
http://lacy.biz;29;2020-05-11 19:11:08;50;American Museum of Natural History;
https://jensen.name;30;2020-05-11 19:11:08;24;Whitney Museum of American Art;Sed in ipsum id urna vestibulum consectetur.
http://virginia.org;30;2020-05-11 19:11:08;41;Victoria and Albert Museum;
https://ariel.net;31;2020-05-11 19:11:08;33;Natural History Museum;
http://roger.info;32;2020-05-11 19:11:08;55;Museum of Ice Cream;Etiam pellentesque turpis vitae lobortis suscipit.
https://carolanne.com;32;2020-05-11 19:11:08;40;;Duis vitae enim in nisl lacinia gravida.
https://margarita.info;32;2020-05-11 19:11:08;42;The Metropolitan Museum of Art;Fusce sollicitudin nisl in turpis mollis
https://kayden.biz;32;2020-05-11 19:11:08;55;The Museum of Modern Art;
https://brook.com;33;2020-05-11 19:11:08;52;Los Angeles County Museum of Art;
https://gust.net;33;2020-05-11 19:11:08;51;American Museum of Natural History;Sed suscipit dui iaculis tellus vehicula blandit.
http://bridie.name;33;2020-05-11 19:11:08;44;;Aenean quis dolor sit amet lorem rutrum iaculis non et tellus.
http://barton.name;33;2020-05-11 19:11:08;56;;Quisque vitae neque in metus dictum auctor sit amet id turpis.
https://karina.biz;33;2020-05-11 19:11:08;50;;
https://mariam.com;35;2020-05-11 19:11:08;56;;
https://trycia.com;35;2020-05-11 19:11:08;40;;Fusce non ligula sed quam posuere tristique.
https://everette.biz;37;2020-05-11 19:11:08;42;;Nam et libero non arcu venenatis finibus eget sed velit.
http://boris.biz;38;2020-05-11 19:11:08;46;;Ut ut nulla nec urna luctus congue.
http://arthur.name;38;2020-05-11 19:11:08;37;;Vestibulum vel turpis a augue sagittis vestibulum ut sit amet augue.
https://cesar.com;39;2020-05-11 19:11:08;26;;Cras convallis augue id dictum consequat.
http://charlie.com;40;2020-05-11 19:11:08;38;;
https://lina.biz;42;2020-05-11 19:11:08;55;;
https://darwin.net;42;2020-05-11 19:11:08;26;;Proin imperdiet nibh vitae metus euismod
https://aliyah.biz;42;2020-05-11 19:11:08;50;;Curabitur venenatis tellus at ipsum pulvinar tincidunt.
http://euna.info;43;2020-05-11 19:11:08;19;;Fusce gravida nunc id velit suscipit
https://maymie.net;43;2020-05-11 19:11:08;25;;Pellentesque ullamcorper odio a libero varius iaculis.
http://joanie.name;43;2020-05-11 19:11:08;32;;Vestibulum interdum enim vel ex tempus consectetur.
http://whitney.net;43;2020-05-11 19:11:08;31;;
http://garrison.name;43;2020-05-11 19:11:08;34;;
https://olga.org;44;2020-05-11 19:11:08;57;;Curabitur sit amet urna aliquet
https://donavon.org;44;2020-05-11 19:11:08;34;;Proin porta lectus sed condimentum laoreet.
http://moses.biz;44;2020-05-11 19:11:08;53;;Aliquam nec nisl nec nisi mattis molestie.
http://shannon.org;44;2020-05-11 19:11:08;20;;Donec elementum enim ut sodales lobortis.
http://kendrick.net;46;2020-05-11 19:11:08;36;;
https://carey.com;46;2020-05-11 19:11:08;49;;
http://lia.biz;46;2020-05-11 19:11:08;53;;Duis sit amet dui eleifend
https://celestine.name;46;2020-05-11 19:11:08;42;NewYork;Aenean id lorem quis arcu dignissim gravida.
http://laila.info;47;2020-05-11 19:11:08;30;Moscow;
http://buddy.com;47;2020-05-11 19:11:08;26;London;
http://americo.biz;47;2020-05-11 19:11:08;41;Sao Paulo;Vivamus scelerisque mi ac mauris egestas dignissim.
http://lurline.info;47;2020-05-11 19:11:08;19;Paris;Maecenas quis metus a enim placerat condimentum.
http://kailee.org;47;2020-05-11 19:11:08;50;Los Angeles;Fusce ullamcorper sapien a tortor eleifend
https://edyth.com;48;2020-05-11 19:11:08;58;St. Petersburg;Ut mollis ex vitae quam lobortis egestas.
https://isaias.biz;50;2020-05-11 19:11:08;40;Jakarta;Quisque at felis eget eros laoreet pharetra.
http://rosetta.net;50;2020-05-11 19:11:08;18;Istanbul;
https://marianna.info;50;2020-05-11 19:11:08;31;Barcelona;
https://roel.org;51;2020-05-11 19:11:08;21;Disneyland;Maecenas maximus eros pharetra ante varius finibus.
http://julia.info;51;2020-05-11 19:11:08;25;Times Square;Integer lobortis lacus id metus viverra feugiat.
https://seamus.org;51;2020-05-11 19:11:08;43;Central Park;
https://earline.info;51;2020-05-11 19:11:08;19;Eiffel Tower;
http://quinten.info;51;2020-05-11 19:11:08;24;Tokyo Disneyland;Mauris at odio id urna laoreet mollis.
https://dolores.org;52;2020-05-11 19:11:08;45;Disney's Magic Kingdom;Aenean ornare nulla eu leo dictum aliquam.
https://aimee.info;52;2020-05-11 19:11:08;55;Louvre Museum;Aliquam volutpat risus et odio porttitor
https://roderick.name;52;2020-05-11 19:11:08;40;Brooklyn Bridge;Phasellus vitae tortor nec urna vulputate egestas nec ac ante.
https://jarret.name;52;2020-05-11 19:11:08;37;Disney California Adventure Park;
https://cathrine.com;52;2020-05-11 19:11:08;33;Louvre Museum;
https://adela.com;55;2020-05-11 19:11:08;51;The Metropolitan Museum of Art;Sed rutrum velit vel erat hendrerit
https://demarco.com;56;2020-05-11 19:11:08;37;The Museum of Modern Art;Nunc tincidunt nisl sed lectus mollis viverra.
https://lila.biz;58;2020-05-11 19:11:08;52;Los Angeles County Museum of Art;
http://ruben.net;58;2020-05-11 19:11:08;51;British Museum;
https://alia.name;58;2020-05-11 19:11:08;32;American Museum of Natural History;Integer sit amet dui vulputate
http://rickey.name;58;2020-05-11 19:11:08;39;Whitney Museum of American Art;
http://janie.com;58;2020-05-11 19:11:08;54;Victoria and Albert Museum;
http://myron.org;58;2020-05-11 19:11:08;60;Natural History Museum;Curabitur dignissim purus in venenatis lobortis.
http://pearl.info;58;2020-05-11 19:11:08;33;Museum of Ice Cream;Pellentesque sed risus at lorem porttitor venenatis.
http://victoria.biz;58;2020-05-11 19:11:08;29;;Maecenas vehicula velit a orci faucibus
https://carmella.com;59;2020-05-11 19:11:08;53;The Metropolitan Museum of Art;Vestibulum eu arcu elementum
http://leo.com;59;2020-05-11 19:11:08;27;The Museum of Modern Art;Proin efficitur dui at erat suscipit efficitur.
http://jedediah.net;59;2020-05-11 19:11:08;21;Los Angeles County Museum of Art;In vel tortor dapibus
http://sedrick.net;59;2020-05-11 19:11:08;30;American Museum of Natural History;
https://clare.org;59;2020-05-11 19:11:08;19;;
https://malcolm.name;59;2020-05-11 19:11:08;58;;Nam facilisis est sed justo porta
https://lesly.com;59;2020-05-11 19:11:08;56;;Maecenas id libero lacinia
https://roberta.net;59;2020-05-11 19:11:08;31;;
https://estell.info;59;2020-05-11 19:11:08;58;;
http://kaleigh.biz;59;2020-05-11 19:11:08;48;;Fusce ullamcorper lacus non ante dignissim aliquet.
http://blanca.org;60;2020-05-11 19:11:08;27;;Praesent sodales arcu molestie condimentum blandit.
http://delpha.com;60;2020-05-11 19:11:08;28;;Nullam id lacus a ante mattis pulvinar ac sit amet justo.
http://annabelle.org;61;2020-05-11 19:11:08;21;;Nullam tincidunt lectus in diam ullamcorper
http://ephraim.com;62;2020-05-11 19:11:08;57;;
https://dameon.name;62;2020-05-11 19:11:08;35;;
https://julianne.org;63;2020-05-11 19:11:08;36;;Sed eu risus vel leo malesuada aliquet non et magna.
https://jasmin.biz;63;2020-05-11 19:11:08;19;;Donec pharetra dolor finibus convallis tempor.
https://delbert.net;63;2020-05-11 19:11:08;42;;Mauris sed dolor at ipsum lacinia mollis ac ut neque.
https://norval.com;63;2020-05-11 19:11:08;39;;Aliquam ullamcorper risus in blandit finibus.
https://jessy.name;64;2020-05-11 19:11:08;20;;Ut sodales nulla eget nisl dignissim tempus.
https://nolan.name;64;2020-05-11 19:11:08;32;;
http://devon.info;64;2020-05-11 19:11:08;29;;
http://ora.net;64;2020-05-11 19:11:08;40;;Etiam quis nisi a nibh ornare dictum.
https://vivien.com;64;2020-05-11 19:11:08;43;;Fusce nec purus in ante bibendum placerat.
https://hilda.info;65;2020-05-11 19:11:08;33;;Nam vehicula quam egestas risus lacinia
https://dorcas.biz;65;2020-05-11 19:11:08;49;;Praesent facilisis dui at odio ullamcorper
http://hettie.net;65;2020-05-11 19:11:08;32;;
http://rico.biz;65;2020-05-11 19:11:08;20;;
http://jody.biz;65;2020-05-11 19:11:08;22;;Donec tempus eros sit amet arcu vulputate
http://sheila.com;67;2020-05-11 19:11:08;56;;Donec elementum quam congue fermentum pretium.
http://germaine.name;67;2020-05-11 19:11:08;53;;
https://mariane.org;67;2020-05-11 19:11:08;29;;
http://reva.com;69;2020-05-11 19:11:08;48;;Morbi sit amet enim nec massa laoreet rutrum quis ac tellus.
https://llewellyn.info;70;2020-05-11 19:11:08;36;;Praesent cursus ligula ac tellus elementum porta.
http://ellen.info;72;2020-05-11 19:11:08;54;;Pellentesque eget mauris at erat consequat tincidunt.
https://anahi.info;72;2020-05-11 19:11:08;27;;Vestibulum hendrerit nulla a sem scelerisque
https://javonte.org;72;2020-05-11 19:11:08;52;;
http://florine.org;72;2020-05-11 19:11:08;30;;
http://marcellus.info;72;2020-05-11 19:11:08;48;;Aenean sit amet tortor a orci iaculis mollis.
http://stan.biz;73;2020-05-11 19:11:08;56;;Vivamus eu diam id libero euismod ornare quis ac nibh.
http://jarred.net;77;2020-05-11 19:11:08;53;;
http://jovanny.net;77;2020-05-11 19:11:08;26;;
http://linnie.com;77;2020-05-11 19:11:08;19;;Aliquam tristique sapien eget nunc dictum mattis.
http://dino.name;77;2020-05-11 19:11:08;43;;
https://jane.net;77;2020-05-11 19:11:08;51;;
http://laney.name;77;2020-05-11 19:11:08;36;;Pellentesque ornare velit eu leo mattis
http://trever.org;78;2020-05-11 19:11:08;55;;Donec sodales sem quis nisi vulputate porttitor.
http://emilie.net;78;2020-05-11 19:11:08;49;;
http://ted.info;78;2020-05-11 19:11:08;48;;
http://keshawn.org;78;2020-05-11 19:11:08;48;NewYork;Sed ut massa pulvinar
http://ole.info;78;2020-05-11 19:11:08;24;Moscow;Nunc at quam aliquet
https://ford.biz;79;2020-05-11 19:11:08;52;London;Curabitur bibendum lacus sit amet ex tempus finibus.
https://humberto.org;82;2020-05-11 19:11:08;25;Sao Paulo;
http://penelope.info;82;2020-05-11 19:11:08;34;Paris;
https://dimitri.info;84;2020-05-11 19:11:08;39;Los Angeles;Vivamus ultricies purus rutrum luctus pretium.
http://cynthia.info;84;2020-05-11 19:11:08;38;St. Petersburg;Proin a purus laoreet
http://princess.org;85;2020-05-11 19:11:08;50;Jakarta;
https://ruthie.info;85;2020-05-11 19:11:08;49;Istanbul;
https://evan.name;86;2020-05-11 19:11:08;21;Barcelona;Phasellus euismod est at laoreet facilisis.
http://deontae.org;86;2020-05-11 19:11:08;53;Disneyland;Curabitur eu quam malesuada lectus fringilla porttitor at sit amet magna.
https://timmy.info;86;2020-05-11 19:11:08;19;Times Square;Phasellus cursus ante id blandit volutpat.
http://susie.info;86;2020-05-11 19:11:08;47;Central Park;Vestibulum et libero cursus
http://hollis.com;86;2020-05-11 19:11:08;46;Eiffel Tower;Vivamus finibus quam non massa accumsan pulvinar.
https://colt.org;86;2020-05-11 19:11:08;48;Tokyo Disneyland;
http://lucio.org;86;2020-05-11 19:11:08;33;Disney's Magic Kingdom;
http://germaine.org;86;2020-05-11 19:11:08;59;Louvre Museum;Aliquam rhoncus nibh at sapien interdum blandit.
http://howard.net;86;2020-05-11 19:11:08;38;Brooklyn Bridge;Morbi id orci fermentum
http://helena.name;87;2020-05-11 19:11:08;47;Disney California Adventure Park;Quisque ullamcorper orci sit amet massa tempus cursus.
https://celestino.name;87;2020-05-11 19:11:08;44;Louvre Museum;Etiam non nisi imperdiet
http://violet.info;87;2020-05-11 19:11:08;54;The Metropolitan Museum of Art;
http://nigel.biz;87;2020-05-11 19:11:08;31;The Museum of Modern Art;
https://noble.net;88;2020-05-11 19:11:08;29;Los Angeles County Museum of Art;Morbi malesuada erat at metus porttitor condimentum.
https://emilia.org;88;2020-05-11 19:11:08;39;British Museum;In ut ante at ante accumsan tristique.
http://destini.net;88;2020-05-11 19:11:08;50;American Museum of Natural History;Nam non tortor vitae justo molestie feugiat.
https://mariano.net;88;2020-05-11 19:11:08;23;Whitney Museum of American Art;Proin vel nibh ac elit posuere sagittis.
https://brittany.org;88;2020-05-11 19:11:08;28;Victoria and Albert Museum;Nam malesuada leo vel dui imperdiet lobortis.
https://madaline.name;88;2020-05-11 19:11:08;58;Natural History Museum;
https://devonte.name;88;2020-05-11 19:11:08;60;Museum of Ice Cream;
https://blanche.net;88;2020-05-11 19:11:08;21;;Aenean sollicitudin velit in hendrerit blandit.
http://cali.net;88;2020-05-11 19:11:08;45;The Metropolitan Museum of Art;Curabitur eleifend metus vel quam luctus
http://mekhi.name;88;2020-05-11 19:11:08;27;The Museum of Modern Art;
http://adela.com;88;2020-05-11 19:11:08;26;Los Angeles County Museum of Art;
https://devan.com;92;2020-05-11 19:11:08;45;American Museum of Natural History;Integer non mauris dapibus nunc rutrum pulvinar eget eu mauris.
https://jarrett.name;92;2020-05-11 19:11:08;18;;Ut lacinia est at enim ullamcorper rutrum.
https://sid.biz;92;2020-05-11 19:11:08;40;;Aenean pellentesque ex eu mauris tempor suscipit.
https://jadyn.name;93;2020-05-11 19:11:08;29;;Curabitur bibendum urna sed leo vehicula
https://erik.com;93;2020-05-11 19:11:08;59;;Aliquam blandit purus quis eros consequat convallis.
http://freeda.biz;94;2020-05-11 19:11:08;19;;
http://ayden.name;95;2020-05-11 19:11:08;30;;
https://kathleen.biz;95;2020-05-11 19:11:08;25;;Donec quis mi cursus
https://helmer.org;96;2020-05-11 19:11:08;26;;Nulla convallis risus et nisl accumsan tempus.
https://maggie.info;96;2020-05-11 19:11:08;28;;Maecenas sed tortor pulvinar leo ornare placerat.
https://cecilia.net;96;2020-05-11 19:11:08;24;NewYork;Aenean quis nisi aliquet elit suscipit vulputate.
http://ayla.org;97;2020-05-11 19:11:08;27;Moscow;Aenean tempus urna quis tempus fermentum.
https://elyssa.biz;97;2020-05-11 19:11:08;57;London;Nulla laoreet turpis in tincidunt fermentum.
http://jennie.com;98;2020-05-11 19:11:08;27;Sao Paulo;
http://ryleigh.info;99;2020-05-11 19:11:08;39;Paris;
https://darien.name;99;2020-05-11 19:11:08;18;Los Angeles;Cras eget neque id leo consequat faucibus ut vel justo.
https://xzavier.org;99;2020-05-11 19:11:08;49;St. Petersburg;Pellentesque id ipsum eu magna commodo scelerisque.
https://kaela.name;100;2020-05-11 19:11:08;18;Jakarta;Quisque eu dui ac dui tincidunt ornare.
http://dedrick.info;100;2020-05-11 19:11:08;19;Istanbul;Curabitur sed purus sit amet mi porta pharetra tempor faucibus turpis.